{
  "schema_version": "1.0",
  "event_id": "33333333-3333-4333-8333-333333333333",
  "ref_id": "event:33333333-3333-4333-8333-333333333333",
  "project_id": "11111111-1111-4111-8111-111111111111",
  "event_type": "BUG_REPORTED",
  "business_status": "REPORTED",
  "review_status": "APPROVED",
  "summary": "Client reported Google Login failure.",
  "occurred_at": "2026-10-12T09:00:00Z",
  "created_at": "2026-10-14T01:00:00Z",
  "source_refs": [
    "source:22222222-2222-4222-8222-222222222222"
  ],
  "version": 1,
  "occurred_at_precision": "INSTANT"
}
